[
  {
    "path": "agente",
    "spec": "Principal",
    "name": "Oportunista",
    "act": "*",
    "inv": null,
    "con": null,
    "mec": "Una vez por ronda, cuando tiras un dado de trama, puedes repetir la tirada. Debes usar el nuevo resultado.",
    "req": "ninguno",
    "flavor": null
  },
  {
    "path": "agente",
    "spec": "Investigador",
    "name": "Ojo avizor",
    "act": "R",
    "inv": null,
    "con": null,
    "mec": "Usa Oportunista sobre el dado de trama de un aliado dispuesto a 6 m o menos de ti.",
    "req": "Deducción 1+",
    "flavor": null
  },
  {
    "path": "agente",
    "spec": "Investigador",
    "name": "Haz que hablen",
    "act": "2",
    "inv": null,
    "con": "1",
    "mec": "Prueba de Deducción contra Espiritual para averiguar las motivaciones del objetivo. Durante la escena puedes subir la apuesta aprovechándote de ellas.",
    "req": "Perspicacia 2+",
    "flavor": null
  },
  {
    "path": "agente",
    "spec": "Investigador",
    "name": "Análisis rápido",
    "act": "0",
    "inv": null,
    "con": "2",
    "mec": "Gasta 2 concentración para obtener 2▶ solo para pruebas cognitivas con Usar habilidad, Obtener ventaja o talentos de Agente.",
    "req": "Ojo avizor",
    "flavor": null
  },
  {
    "path": "agente",
    "spec": "Investigador",
    "name": "Desenlace seguro",
    "act": "*",
    "inv": null,
    "con": "2",
    "mec": "Cuando usas Oportunista, en lugar de volver a tirar, gasta 2 concentración para que el dado muestre un resultado específico (O→C4 o C→O).",
    "req": "Perspicacia 2+",
    "flavor": null
  },
  {
    "path": "agente",
    "spec": "Investigador",
    "name": "Serenidad",
    "act": "8",
    "inv": null,
    "con": null,
    "mec": "Tus Defensas cognitiva y espiritual aumentan en 2.",
    "req": "Desenlace seguro",
    "flavor": null
  },
  {
    "path": "agente",
    "spec": "Investigador",
    "name": "Recopilar pruebas",
    "act": "8",
    "inv": null,
    "con": null,
    "mec": "Obtienes pericia en Códigos legales. Cuando superas una prueba cognitiva contra un objetivo, quedas Concentrado.",
    "req": "Perspicacia 2+",
    "flavor": null
  },
  {
    "path": "agente",
    "spec": "Investigador",
    "name": "Instintos de sabueso",
    "act": "8",
    "inv": null,
    "con": null,
    "mec": "Ventaja en pruebas cognitivas contra personajes cuya motivación conoces. Sabes cuándo te mienten.",
    "req": "Deducción 3+",
    "flavor": null
  },
  {
    "path": "agente",
    "spec": "Investigador",
    "name": "Robusto",
    "act": "8",
    "inv": null,
    "con": null,
    "mec": "+1 de salud máxima por nivel (incluidos los niveles anteriores).",
    "req": "Recopilar pruebas",
    "flavor": null
  },
  {
    "path": "agente",
    "spec": "Investigador",
    "name": "Cerrar el caso",
    "act": "3",
    "inv": null,
    "con": "3",
    "mec": "Prueba de Deducción contra Cognitiva (ventaja si conoces sus motivaciones). Si la superas, el objetivo se echa atrás. Si fracasas, él obtiene ventaja contra ti.",
    "req": "Deducción 3+, Robusto",
    "flavor": null
  },
  {
    "path": "agente",
    "spec": "Espía",
    "name": "Excusa plausible",
    "act": "R",
    "inv": null,
    "con": "2",
    "mec": "Tras ser descubierto merodeando, hazte pasar por alguien inocente. Los personajes que resistan gastan concentración adicional igual a tus grados en Engaño.",
    "req": "Engaño 1+",
    "flavor": null
  },
  {
    "path": "agente",
    "spec": "Espía",
    "name": "Tapadera",
    "act": "8",
    "inv": null,
    "con": null,
    "mec": "Creas una identidad falsa con reputación en ciertas comunidades. Obtienes una pericia cultural relevante.",
    "req": "Excusa plausible",
    "flavor": null
  },
  {
    "path": "agente",
    "spec": "Espía",
    "name": "Poderoso",
    "act": "8",
    "inv": null,
    "con": null,
    "mec": "Al impactar con arma o ataque sin armas: por cada ▶ gastada, inflige daño adicional de 1 + tu rango.",
    "req": "Tapadera",
    "flavor": null
  },
  {
    "path": "agente",
    "spec": "Espía",
    "name": "Derribo sutil",
    "act": "2",
    "inv": null,
    "con": null,
    "mec": "Ataque sin armas con Perspicacia contra Cognitiva de un objetivo desprevenido (tu tamaño o menor), subiendo la apuesta. Si impactas, no puede comunicarse y puedes Agarrar como ◉.",
    "req": "Perspicacia 3+, Tapadera",
    "flavor": null
  },
  {
    "path": "agente",
    "spec": "Espía",
    "name": "Fachada volátil",
    "act": "*",
    "inv": null,
    "con": null,
    "mec": "Disfrázate usando Engaño sin materiales físicos. El primer personaje que te descubra queda Sorprendido.",
    "req": "Engaño 3+, Derribo sutil",
    "flavor": null
  },
  {
    "path": "agente",
    "spec": "Espía",
    "name": "Contactos en la alta sociedad",
    "act": "*",
    "inv": null,
    "con": "2",
    "mec": "Obtienes pericia en Alta sociedad. Gasta 2 concentración para añadir O a pruebas de interacción con la alta sociedad.",
    "req": "Patrocinador alta sociedad, Tapadera",
    "flavor": null
  },
  {
    "path": "agente",
    "spec": "Ladrón",
    "name": "Golpe bajo",
    "act": "1",
    "inv": null,
    "con": "1",
    "mec": "Ataque sin armas contra Cognitiva, subiendo la apuesta. Si impactas, el objetivo queda Aturdido.",
    "req": "ninguno",
    "flavor": null
  },
  {
    "path": "agente",
    "spec": "Ladrón",
    "name": "Comportamiento arriesgado",
    "act": "*",
    "inv": null,
    "con": "1",
    "mec": "Gasta 1 concentración para subir la apuesta de tu prueba.",
    "req": "Perspicacia 2+",
    "flavor": null
  },
  {
    "path": "agente",
    "spec": "Ladrón",
    "name": "Obstinarse",
    "act": "*",
    "inv": null,
    "con": null,
    "mec": "Puedes usar Oportunista de nuevo, pero si sacas C pierdes 2 concentración.",
    "req": "Golpe bajo",
    "flavor": null
  },
  {
    "path": "agente",
    "spec": "Ladrón",
    "name": "Paso sombrío",
    "act": "▷",
    "inv": null,
    "con": "2",
    "mec": "Tras Destrabarte, gasta 2 concentración para hacer prueba de Hurto contra Cognitiva de cada enemigo y ocultarte. Ventaja si estás a cubierto u oculto.",
    "req": "Hurto 3+",
    "flavor": null
  },
  {
    "path": "agente",
    "spec": "Ladrón",
    "name": "Mano embaucadora",
    "act": "▷",
    "inv": null,
    "con": "2",
    "mec": "Gasta 2 concentración para obtener 2▶ solo para pruebas físicas con Usar habilidad, Obtener ventaja o talentos de Agente.",
    "req": "Hurto 3+",
    "flavor": null
  },
  {
    "path": "agente",
    "spec": "Ladrón",
    "name": "Charlatanería",
    "act": "▷",
    "inv": null,
    "con": "2",
    "mec": "Gasta 2 concentración para obtener 2▶ solo para pruebas espirituales con Usar habilidad, Obtener ventaja o talentos de Agente.",
    "req": "Perspicacia 3+",
    "flavor": null
  },
  {
    "path": "agente",
    "spec": "Ladrón",
    "name": "Paso firme",
    "act": "8",
    "inv": null,
    "con": null,
    "mec": "+3 al valor de movimiento. Reduce el daño por caída y terreno peligroso en el doble de tu rango.",
    "req": "Obstinarse",
    "flavor": null
  },
  {
    "path": "agente",
    "spec": "Ladrón",
    "name": "Contactos en los bajos fondos",
    "act": "*",
    "inv": null,
    "con": "2",
    "mec": "Obtienes pericia en Grupos delictivos. Gasta 2 concentración para añadir O a pruebas sociales contra delincuentes.",
    "req": "Patrocinador bajos fondos",
    "flavor": null
  },
  {
    "path": "agente",
    "spec": "Ladrón",
    "name": "Torvo",
    "act": "8",
    "inv": null,
    "con": null,
    "mec": "Para resistirse a tu influencia, un personaje debe gastar concentración adicional igual a tu rango.",
    "req": "Paso firme",
    "flavor": null
  },
  {
    "path": "cazador",
    "spec": "Principal",
    "name": "Buscar presa",
    "act": "*",
    "inv": null,
    "con": null,
    "mec": "Tras 1 minuto preparándote, elige un personaje al que puedas sentir o hayas conocido como presa. Obtienes ventaja en todas las pruebas para encontrarlo, atacarlo y estudiarlo.",
    "req": "ninguno",
    "flavor": null
  },
  {
    "path": "cazador",
    "spec": "Arquero",
    "name": "Disparo de seguimiento",
    "act": "3",
    "inv": null,
    "con": null,
    "mec": "Muévete 1,5 m y haz un ataque a distancia. Si impactas o haces un rasguño, el objetivo se convierte en tu presa.",
    "req": "Percepción 2+",
    "flavor": null
  },
  {
    "path": "cazador",
    "spec": "Arquero",
    "name": "Entrenamiento de combate",
    "act": "*",
    "inv": null,
    "con": null,
    "mec": "Una vez por ronda, cuando fallas un ataque, haz un rasguño sin gastar concentración. Obtienes pericia en un arma, una armadura y Vida militar.",
    "req": "Buscar presa",
    "flavor": null
  },
  {
    "path": "cazador",
    "spec": "Arquero",
    "name": "Ojo agudo",
    "act": "*",
    "inv": null,
    "con": null,
    "mec": "Gasta 1▶ observando a tu presa. Prueba de Percepción contra Cognitiva para saber: su atributo más bajo, su defensa más baja, o si ha perdido más de la mitad de salud/concentración/Investidura.",
    "req": "Disparo de seguimiento",
    "flavor": null
  },
  {
    "path": "cazador",
    "spec": "Arquero",
    "name": "Puntería firme",
    "act": "1",
    "inv": null,
    "con": null,
    "mec": "El alcance de tu arma aumenta en la mitad de su valor e infliges daño adicional igual a tus grados en Percepción.",
    "req": "Agilidad 1+",
    "flavor": null
  },
  {
    "path": "cazador",
    "spec": "Arquero",
    "name": "Explotar debilidad",
    "act": "0",
    "inv": null,
    "con": null,
    "mec": "Usa Obtener ventaja como ◉, apuntando solo a tu presa.",
    "req": "Percepción 3+, Ojo agudo",
    "flavor": null
  },
  {
    "path": "cazador",
    "spec": "Arquero",
    "name": "Paso atrás",
    "act": "▷",
    "inv": null,
    "con": "2",
    "mec": "Tras atacar a distancia, gasta 2 concentración para Destrabarte sin gastar ▶. Usa Prevenirse si entras en zona a cubierto.",